{
  "h2a_version": "0.1",
  "status_list_id": "5a6b7c80-4444-4b2a-9c33-8a1b2c3d4e5f",
  "iss": "https://issuer.example.org/h2a/issuer",
  "purpose": "revocation",
  "encoding": "base64url-bitstring",
  "list": "eJzTBQAAMAAw",
  "mirrors": ["https://cdn.example.net/h2a/status/2026-q3.json"],
  "valid_from": "2026-07-20T00:00:00Z",
  "valid_until": "2026-07-20T01:00:00Z",
  "alg": "ES256",
  "signature": "BASE64URL_SIG"
}
